{
  "approval": {
    "approved": false,
    "approvedBy": "owner Assembly Review Gate pending",
    "notes": "Neutral assembly evidence only; no material, runtime/public-model, or shading approval."
  },
  "artifactBasePath": "/mnt/2TBHDD/CockpitEscapeRoom",
  "createdAt": "2026-08-28T00:00:00Z",
  "inputs": [
    {
      "bytes": 1305,
      "path": "art-source/cockpit-pipeline/jobs/dc9-memphis-legacy-source/source-approval.json",
      "sha256": "5756c11798c0b5e39a932a6983525906bec45636579a0512d3bb417dcd976b0b"
    },
    {
      "bytes": 4499,
      "path": "art-source/cockpit-pipeline/jobs/dc9-memphis-legacy-source/manifests/sourcing-complete.json",
      "sha256": "53802b3b648bfb048c81b1e8d930ed3a97232ee1f3a9014079e94da9c235dd7a"
    },
    {
      "bytes": 19968,
      "path": "art-source/cockpit-pipeline/stages/source/output/dc9-memphis-legacy-source/dc9-memphis-concourse-b-source.glb",
      "sha256": "6cc30543653173d64b2997468009677e72e8923a184aaf886d01b1a842249177"
    },
    {
      "bytes": 3321,
      "path": "art-source/cockpit-pipeline/stages/source/output/dc9-memphis-legacy-source/candidate-metadata.json",
      "sha256": "70740b2137ac30e06611e39d4f119ada0b889d853e80d4f5d408767a7b200c32"
    }
  ],
  "jobId": "dc9-memphis-legacy-assembly",
  "manifestId": "dc9-memphis-legacy-assembly-complete",
  "outputs": [
    {
      "bytes": 110121,
      "path": "art-source/cockpit-pipeline/stages/assembly/output/dc9-memphis-legacy-assembly/dc9-memphis-legacy-neutral.blend",
      "sha256": "ce79b2b9373c9f2cd213f679d24603aba6d00162b750c8bd257a053cafc93e15"
    },
    {
      "bytes": 63128,
      "path": "art-source/cockpit-pipeline/stages/assembly/output/dc9-memphis-legacy-assembly/dc9-memphis-legacy-neutral.glb",
      "sha256": "8c7b2b9e3d008b11fc3df76b02cafc64cc3e7c80d05adf186b794970d55c26e3"
    },
    {
      "bytes": 2969,
      "path": "art-source/cockpit-pipeline/stages/assembly/output/dc9-memphis-legacy-assembly/resolved-layout.json",
      "sha256": "bed9742136ccc2ff1a2c1aabdae444de6002ecdadfe6d57210193b3046d1438b"
    },
    {
      "bytes": 1908,
      "path": "art-source/cockpit-pipeline/stages/assembly/output/dc9-memphis-legacy-assembly/node-pivot-report.json",
      "sha256": "cd2d97bd91f1698b28a68461f15813a68c262ffc09587e66f9363317b966bb3c"
    },
    {
      "bytes": 750,
      "path": "art-source/cockpit-pipeline/stages/assembly/output/dc9-memphis-legacy-assembly/assembly-validation.json",
      "sha256": "b8df1ca991f1a5d3b0e7691d6b6756aa315ab9ddf163f496a2a66662a828c48e"
    },
    {
      "bytes": 1355779,
      "path": "art-source/cockpit-pipeline/stages/assembly/output/dc9-memphis-legacy-assembly/previews/neutral-1440.png",
      "sha256": "226e306eb286352f030033e4505ea8d3ff792d8403c08847a6b13ce0dfe95c80"
    },
    {
      "bytes": 378160,
      "path": "art-source/cockpit-pipeline/stages/assembly/output/dc9-memphis-legacy-assembly/previews/neutral-768.png",
      "sha256": "322bd2e784e04ed95cab0ea432e40304a2f581f9bab09875dd1b6a85c197fcb4"
    },
    {
      "bytes": 94514,
      "path": "art-source/cockpit-pipeline/stages/assembly/output/dc9-memphis-legacy-assembly/previews/neutral-375.png",
      "sha256": "de1dc86cbcf68fe524c0db746c5f09daff4c79ecfa9e988c9d7666c69e1ca7ea"
    },
    {
      "bytes": 1263801,
      "path": "art-source/cockpit-pipeline/stages/assembly/output/dc9-memphis-legacy-assembly/previews/windshield-ramp-start-1440.png",
      "sha256": "65a136ac3f75a1f3f94ea05f0e466e0b2e34d33335381b37c54f5c6f16194961"
    },
    {
      "bytes": 680614,
      "path": "art-source/cockpit-pipeline/stages/assembly/output/dc9-memphis-legacy-assembly/previews/windshield-ramp-start-768.png",
      "sha256": "54cb0928cfb34b91e894ad761e8fea2c35eb1d7ea479b7fdf26c120afda04670"
    },
    {
      "bytes": 303016,
      "path": "art-source/cockpit-pipeline/stages/assembly/output/dc9-memphis-legacy-assembly/previews/windshield-ramp-start-375.png",
      "sha256": "99d606f7c4d1f424042962181b44c7a88bbcead0860c60f033096b220ae75da8"
    },
    {
      "bytes": 1257567,
      "path": "art-source/cockpit-pipeline/stages/assembly/output/dc9-memphis-legacy-assembly/previews/windshield-hold-short-1440.png",
      "sha256": "9a07a1e71e2e509ad7c63110cd9a19391f836d1f943bd91a61f968247460cf21"
    },
    {
      "bytes": 1252990,
      "path": "art-source/cockpit-pipeline/stages/assembly/output/dc9-memphis-legacy-assembly/previews/windshield-runway-lineup-1440.png",
      "sha256": "fbee94fd0eb30fb10140f08ca6bd73bdbdd3bc3079b057460cc5348b2e5b228f"
    },
    {
      "bytes": 1307566,
      "path": "art-source/cockpit-pipeline/stages/assembly/output/dc9-memphis-legacy-assembly/previews/windshield-takeoff-roll-1440.png",
      "sha256": "8da35ed39f907f0fd761bde757a5a9304d9adea12a52914557b78c5878755dc5"
    },
    {
      "bytes": 2547,
      "path": "art-source/cockpit-pipeline/gates/dc9-memphis-legacy-runtime-contract.json",
      "sha256": "1506c791dc2b4e5681eb079a7de3690cec28425d65ec3f619b29d7416e2092a6"
    }
  ],
  "sourceVariant": "Ted Davis KMEM X-Plane scenery revision 2019-01-22",
  "stage": "assembly_complete",
  "targetVariant": "1995 Memphis memory recreation",
  "variantScope": "common"
}
