{
  "manifestId": "a320-cockpit-2-assembly-assembly-complete",
  "jobId": "a320-cockpit-2-assembly",
  "stage": "assembly_complete",
  "createdAt": "2026-07-10T02:03:20Z",
  "sourceVariant": "prebuilt-free-open-leads",
  "targetVariant": "Airbus A320",
  "variantScope": "target-confirmed",
  "artifactBasePath": "/mnt/2TBHDD/CockpitEscapeRoom",
  "inputs": [
    {
      "path": "art-source/cockpit-pipeline/jobs/a320-prebuilt-parts-source-discovery/source-approval.json",
      "sha256": "0abda4a5af5db9c304ed96c3b3c478d2c32537591cd7953c9d91d9037e3b1952",
      "bytes": 973
    },
    {
      "path": "art-source/cockpit-pipeline/jobs/a320-prebuilt-parts-source-discovery/manifests/sourcing-complete.json",
      "sha256": "6367658d6c244de17c4539d2f7485f160c5552d586671fdb6c23a42ce4ec0cb0",
      "bytes": 1991
    },
    {
      "path": "asset-reports/cockpit-pipeline/a320-prebuilt-parts-source-discovery/a320-cockpit-2-blender-import-report.json",
      "sha256": "c12abe57ad16c4c0a41db9249abfa90953683b05d2c7ca98106f0aef4bfbdbf8",
      "bytes": 10577
    }
  ],
  "outputs": [
    {
      "path": "art-source/cockpit-pipeline/stages/assembly/output/a320-cockpit-2-assembly/a320-cockpit-2-assembly.blend",
      "sha256": "d6a5b869d35e684bfde619fec05dc40b772d593a3e93cc8e3330eefd67e39ae8",
      "bytes": 24237050
    },
    {
      "path": "art-source/cockpit-pipeline/stages/assembly/output/a320-cockpit-2-assembly/a320-cockpit-2-assembly.glb",
      "sha256": "435ec66260561267a2aefbdf8dbd3a10ea0e69904a7125d2aa8420668cb9f49b",
      "bytes": 39785356
    },
    {
      "path": "art-source/cockpit-pipeline/stages/assembly/output/a320-cockpit-2-assembly/node-pivot-report.json",
      "sha256": "a5ff6775651ce3141420d0d7ee86894126d8faac031c322a41b7e6c5869d0627",
      "bytes": 93079
    },
    {
      "path": "art-source/cockpit-pipeline/stages/assembly/output/a320-cockpit-2-assembly/validation-report.json",
      "sha256": "e403f9604334c1b940abcd2e2fc8bb07c5db02877f652d4e7384057b6a7c5945",
      "bytes": 954
    },
    {
      "path": "art-source/cockpit-pipeline/stages/assembly/output/a320-cockpit-2-assembly/runtime-contract-summary.json",
      "sha256": "0a90c42010217e6a3d3b7047e4f8919c2c8c0bb2801a8841651faaf27d44aabb",
      "bytes": 7915
    },
    {
      "path": "art-source/cockpit-pipeline/gates/a320-cockpit-2-runtime-contract.json",
      "sha256": "51a1b89d7a58ed477fec38b6f4de4d941aded7eec8b1f9a2caa7c0f8cb45cfa5",
      "bytes": 9171
    },
    {
      "path": "asset-reports/cockpit-pipeline/a320-cockpit-2-assembly/assembly-report.md",
      "sha256": "0d4524ef5358a8507770964d5d488de639567b79bbd892f6cc6d7a547ec91876",
      "bytes": 4386
    },
    {
      "path": "preview-renders/cockpit-pipeline/a320-cockpit-2-assembly/captain-seat-view.png",
      "sha256": "5d3eaefa36b60c89b5fb57eff7a2c4a5da5037ba8966c8802af5b1b11a20b962",
      "bytes": 1163191
    },
    {
      "path": "preview-renders/cockpit-pipeline/a320-cockpit-2-assembly/dashboard-screens-view.png",
      "sha256": "817bae76196b2b9a233fdc27900a4e8ef68e7e46aef2a5be665f6a356827c1f0",
      "bytes": 954858
    }
  ],
  "approval": {
    "approved": false,
    "approvedBy": "human-review-pending",
    "notes": "A320 Agent 2 assembly complete only. Human review is required before assembly approval and before Agent 3 materials/optimization."
  }
}
