{
  "manifestId": "sample-dc9-unresolved-source-approved",
  "jobId": "sample-dc9-unresolved-vertical-slice",
  "stage": "source-approved",
  "createdAt": "2026-06-22T00:00:00Z",
  "sourceVariant": "DC-9-32 source material permitted for proof",
  "targetVariant": "unresolved owner-confirmed DC-9 variant",
  "variantScope": "unresolved",
  "artifactBasePath": "../evidence",
  "inputs": [],
  "outputs": [
    {
      "path": "source-technical-note.txt",
      "sha256": "720c8eb33701dd7ba4c81a3c59008dea6fbf241e12db9d1cd6a0cb1b083c8794",
      "bytes": 473
    }
  ],
  "approval": {
    "approved": true,
    "approvedBy": "pipeline-foundation-sample",
    "notes": "Sample manifest only; validates state and hashing contracts without sourcing or constructing a cockpit."
  }
}
