{
  "manifestId": "dc9-vslice-assembly-assembly-complete",
  "jobId": "dc9-vslice-assembly",
  "stage": "assembly_complete",
  "createdAt": "2026-06-22T23:32:45Z",
  "sourceVariant": "DC-9-32",
  "targetVariant": "unresolved",
  "variantScope": "unknown",
  "artifactBasePath": "/mnt/2TBHDD/CockpitEscapeRoom",
  "inputs": [
    {
      "path": "art-source/cockpit-pipeline/stages/source/output/dc9-32-flightgear-source-vslice/candidates/dc9-src-yoke-assembly-001/dc9-src-yoke-assembly-001.glb",
      "sha256": "239bbf3965cb1a4381688371f4852f9223067bf5d98f50661acb53bddc3635ba",
      "bytes": 92632
    },
    {
      "path": "art-source/cockpit-pipeline/stages/source/output/dc9-32-flightgear-source-vslice/candidates/dc9-src-throttle-assembly-001/dc9-src-throttle-assembly-001.glb",
      "sha256": "5164a13f819752326afd22a55003f6fcc033b7330feb0a7c72f333988c3f7b27",
      "bytes": 111892
    },
    {
      "path": "art-source/cockpit-pipeline/stages/source/output/dc9-32-flightgear-source-vslice/candidates/dc9-src-large-gauge-001/dc9-src-large-gauge-001.glb",
      "sha256": "29084fed84550f6214a487235ba504b6390b2799ea36eff99e74451702e6d494",
      "bytes": 21236
    },
    {
      "path": "art-source/cockpit-pipeline/stages/source/output/dc9-32-flightgear-source-vslice/candidates/dc9-src-switch-cluster-001/dc9-src-switch-cluster-001.glb",
      "sha256": "e594a06f7bcde72257bda038f9163a343eeef3670c6e715db1776ebf2d9c4d3b",
      "bytes": 15752
    },
    {
      "path": "art-source/cockpit-pipeline/stages/source/output/dc9-32-flightgear-source-vslice/candidates/dc9-src-yoke-assembly-001/dc9-src-yoke-assembly-001.metadata.json",
      "sha256": "016da52d0368708e05d00d241654ac28d223787c6595c91b3d065eeabdfb8024",
      "bytes": 2264
    },
    {
      "path": "art-source/cockpit-pipeline/stages/source/output/dc9-32-flightgear-source-vslice/candidates/dc9-src-throttle-assembly-001/dc9-src-throttle-assembly-001.metadata.json",
      "sha256": "5535a510775828f3c98d60c02dbd5b052586a5a0f909b4c4c91e4a57244b8fd4",
      "bytes": 2679
    },
    {
      "path": "art-source/cockpit-pipeline/stages/source/output/dc9-32-flightgear-source-vslice/candidates/dc9-src-large-gauge-001/dc9-src-large-gauge-001.metadata.json",
      "sha256": "10fa19407d5d995d8f936fd673e04b768a1ea60e052a7d78b714e55d6f64e418",
      "bytes": 2594
    },
    {
      "path": "art-source/cockpit-pipeline/stages/source/output/dc9-32-flightgear-source-vslice/candidates/dc9-src-switch-cluster-001/dc9-src-switch-cluster-001.metadata.json",
      "sha256": "4eadd7950a23773c008d875be64acbd2b9b838bbe06e58fc854ad91e2ead1f17",
      "bytes": 2305
    },
    {
      "path": "art-source/cockpit-pipeline/jobs/dc9-32-flightgear-source-vslice/source-approval.json",
      "sha256": "c42fe888db6a7d3656f39b1b31e841e88f404314eceb56286d2b4d423464df9a",
      "bytes": 3094
    },
    {
      "path": "art-source/cockpit-pipeline/jobs/dc9-32-flightgear-source-vslice/manifests/sourcing-complete.json",
      "sha256": "dd6fba4f9df6c46252c222b9306c2907759650d516bfe30f86581f97d58eb916",
      "bytes": 7242
    }
  ],
  "outputs": [
    {
      "path": "art-source/cockpit-pipeline/stages/assembly/output/dc9-vslice-assembly/dc9-vslice-assembly.blend",
      "sha256": "3b057e35d609ec1c9c8665abde13495debf94215a98ffdbc624a2460d7178aed",
      "bytes": 218160
    },
    {
      "path": "art-source/cockpit-pipeline/stages/assembly/output/dc9-vslice-assembly/dc9-vslice-assembly.glb",
      "sha256": "12697eadb8cb261e2945cebda86e6639da48f33b1e7c2095d429c59b5e58e7db",
      "bytes": 287216
    },
    {
      "path": "art-source/cockpit-pipeline/stages/assembly/output/dc9-vslice-assembly/resolved-layout.json",
      "sha256": "9b0d56b833f7f1483f762396d633edc8f22007f749a800aa6c5ad683897a2dd0",
      "bytes": 7989
    },
    {
      "path": "art-source/cockpit-pipeline/stages/assembly/output/dc9-vslice-assembly/node-pivot-report.json",
      "sha256": "927080771a600c2ee822f2be1306ea57c6b50a5afd1d5ee65573afc9fab495e0",
      "bytes": 14239
    },
    {
      "path": "art-source/cockpit-pipeline/stages/assembly/output/dc9-vslice-assembly/validation-report.json",
      "sha256": "ee65fc45ddccd8ef2be04945868e68a2d89b58151a0cb35d8450f76342108159",
      "bytes": 815
    },
    {
      "path": "asset-reports/cockpit-pipeline/dc9-vslice-assembly/assembly-report.md",
      "sha256": "b72e5497239e5eddd658ac26bdad8748bbc17043496d33e553b6cf0b1eab0673",
      "bytes": 2769
    },
    {
      "path": "preview-renders/cockpit-pipeline/dc9-vslice-assembly/captain-seat-view.png",
      "sha256": "9da8882cb42345a8004855e5d6b94ed0d7929fca63c736df4d152618e89acbf2",
      "bytes": 636366
    },
    {
      "path": "preview-renders/cockpit-pipeline/dc9-vslice-assembly/wide-cockpit-view.png",
      "sha256": "c233ea06b10e63493863bdd78226337c7a874ed3b1c4b92bc62005bc53753aa1",
      "bytes": 608000
    },
    {
      "path": "preview-renders/cockpit-pipeline/dc9-vslice-assembly/yoke-close-up.png",
      "sha256": "9794bae609e5653d10a1be4d9f4f727229645143e7f501d53087537ebcf5f962",
      "bytes": 716970
    },
    {
      "path": "preview-renders/cockpit-pipeline/dc9-vslice-assembly/pedestal-throttle-close-up.png",
      "sha256": "5edb7e9dc7154ab71d51cb5506d60ba65984b7a866cc5aa2cabca2b58401c739",
      "bytes": 822606
    },
    {
      "path": "preview-renders/cockpit-pipeline/dc9-vslice-assembly/gauge-switch-close-up.png",
      "sha256": "dfd055327dc0a0bc186277b5f1da8f55124cac15b2142db25bcd44975b44e67a",
      "bytes": 739328
    }
  ],
  "approval": {
    "approved": false,
    "approvedBy": "human-review-pending",
    "notes": "Assembly complete only. Human review is required before assembly approval and before Agent 3 shading."
  }
}
